Glowacz, Jobina, Female, Violet, 2008-07-07T07:09:53Z
Drejer, Willette, Female, White, 2007-12-07T19:49:47Z
Bourne, Emelina, Female, White, 2017-02-18T22:14:03Z
Krojn, Prent, Male, Red, 2005-07-09T06:01:22Z
Symson, Katlin, Female, Blue, 1996-11-18T21:03:20Z
Gibben, Tiff, Female, Indigo, 2003-08-01T19:04:56Z
Petrol, Caye, Female, Indigo, 2009-06-12T07:37:06Z
Caze, Jenda, Female, Black, 2012-04-28T05:37:09Z
Riedel, Ysabel, Female, Green, 2012-03-01T16:41:34Z
Sarrell, Christy, Female, Blue, 2011-05-20T10:10:36Z
Baszniak, Brunhilde, Female, Blue, 2001-03-05T21:09:04Z
Shaxby, Barnebas, Male, Green, 2005-11-18T12:31:25Z
Flury, Erny, Male, Yellow, 2010-09-11T17:51:17Z
Beeck, Dieter, Male, Orange, 2005-12-12T18:53:58Z
Paireman, Lissi, Female, Orange, 2012-04-20T00:20:27Z
Padden, Thurstan, Male, Blue, 1990-02-14T19:33:28Z
Digman, Nan, Female, Indigo, 2001-09-13T09:11:30Z
O'Hagerty, Arnaldo, Male, Indigo, 2002-02-16T05:15:17Z
Riccard, Thurstan, Male, Violet, 2008-05-11T16:04:50Z
Bessom, Prentiss, Male, White, 2003-09-05T03:04:11Z
Reede, Baillie, Male, Orange, 2007-01-20T21:24:22Z
Simmig, Kaitlyn, Female, Green, 1993-12-24T01:35:33Z
Jakubski, My, Male, Indigo, 1997-08-01T09:27:33Z
Perris, Erinn, Female, Blue, 2013-12-17T02:45:10Z
Pinard, Fraser, Male, Black, 2009-10-08T15:59:26Z
Chave, Gard, Male, Indigo, 2003-09-02T10:44:51Z
Terry, Moises, Male, Yellow, 2009-04-16T14:30:09Z
Minogue, Myles, Male, Black, 2017-06-30T19:22:26Z
MacCard, Rurik, Male, Green, 2011-07-14T21:47:17Z
Brend, Clevey, Male, Red, 2013-09-25T08:53:31Z
Molson, Marguerite, Female, Violet, 1995-03-08T23:46:21Z
Kilgour, Vite, Male, Indigo, 2004-10-03T21:04:02Z
Iacovucci, Roldan, Male, Violet, 2017-04-09T06:56:35Z
Nourse, Dagny, Male, Indigo, 2015-01-31T05:17:26Z
Suller, Isac, Male, Green, 2002-01-18T21:34:23Z
Lobley, Dix, Female, Blue, 2017-01-31T14:43:08Z
Gardner, Ailsun, Female, Red, 2003-10-13T15:31:00Z
Jakobssen, Karissa, Female, Red, 2004-09-16T06:12:09Z
Dore, Rhetta, Female, Indigo, 1995-05-27T21:00:12Z
Lambregts, Bealle, Male, Red, 1990-02-09T02:47:08Z
Vondra, Derby, Male, Red, 2003-05-15T16:00:56Z
Alenichicov, Phoebe, Female, Red, 2014-04-10T07:40:24Z
Carle, Bail, Male, Green, 1991-01-28T15:40:03Z
Cosson, Hill, Male, Blue, 1993-07-18T15:39:12Z
Screech, Pierrette, Female, Yellow, 2008-08-08T01:27:16Z
Petruskevich, Wendell, Male, White, 2003-05-07T22:31:06Z
Boulger, Beilul, Female, Blue, 2013-10-13T17:19:51Z
Reedie, Paton, Male, Indigo, 2014-01-23T04:17:46Z
Fisk, Katerine, Female, Yellow, 1995-04-12T21:40:50Z
Llewellin, Jackelyn, Female, Green, 1999-04-04T06:11:20Z
Lipsett, Malena, Female, Red, 2017-05-28T09:12:14Z
Higford, Teddy, Male, Blue, 1998-03-07T00:16:19Z
Harbar, Antonia, Female, Yellow, 1991-05-09T20:58:34Z
Dracksford, Thane, Male, Indigo, 2007-05-28T05:22:06Z
Satford, Reuben, Male, White, 2013-10-20T14:45:46Z
Whanstall, Karly, Female, Red, 2007-02-24T05:01:08Z
Turton, Trenna, Female, Green, 2003-11-21T08:24:09Z
Wainer, Virgilio, Male, Green, 1994-06-01T05:42:05Z
Sonner, Beau, Male, Violet, 2016-05-28T18:19:20Z
Beton, Hirsch, Male, Yellow, 2001-07-31T02:32:06Z
Pock, Afton, Female, Yellow, 1997-06-23T19:17:45Z
Kidwell, Mallorie, Female, Violet, 1998-09-28T11:11:49Z
Watmough, Pam, Female, White, 1996-11-17T17:58:17Z
Megany, Rolland, Male, Yellow, 2014-02-16T19:12:26Z
Minogue, Donielle, Female, Yellow, 2002-01-22T07:51:22Z
Fishpond, Angelique, Female, Black, 2013-04-09T14:20:27Z
Gabbott, Benny, Male, White, 2014-01-10T09:15:00Z
MacDearmont, Hortense, Female, Orange, 1995-09-08T05:08:10Z
L'Hommee, Carine, Female, Black, 2014-04-01T10:58:20Z
Probart, Kipp, Male, Orange, 2008-02-05T06:46:42Z
Masdin, Elisabetta, Female, White, 2005-07-21T01:29:55Z
Goter, Frank, Male, Indigo, 2002-08-20T02:52:09Z
Creech, Thedric, Male, Violet, 2003-04-20T12:16:57Z
Pashba, Austine, Female, Blue, 1996-12-04T05:22:14Z
Perch, Jeanie, Female, White, 2010-12-03T07:05:30Z
Gully, Hannah, Female, Violet, 2011-01-24T21:36:41Z
Caig, Lenci, Male, White, 2001-07-30T14:59:57Z
Cardoe, Lisle, Male, Orange, 2013-10-30T06:48:37Z
Bartosch, Stanislaw, Male, Green, 2008-11-03T22:51:08Z
Lipprose, Udale, Male, Red, 1994-07-16T11:16:22Z
Chandler, Elana, Female, Green, 1992-06-03T17:15:32Z
Enion, Melony, Female, Green, 1992-04-20T00:41:37Z
Linner, Aurelea, Female, Black, 1991-07-25T21:18:44Z
Begg, Mireielle, Female, Red, 2001-02-21T19:38:25Z
Kemm, Flori, Female, Yellow, 1991-04-03T13:25:32Z
Jacmar, Donella, Female, Black, 1996-05-22T19:48:41Z
Swinbourne, Belva, Female, Orange, 1996-09-21T10:54:41Z
Abramcik, Bernadine, Female, White, 1998-04-05T18:47:45Z
Glyssanne, Deva, Female, Green, 2009-03-25T21:14:59Z
Woodyatt, Tiebout, Male, Green, 2001-04-04T12:09:07Z
Kroch, Ricki, Male, Indigo, 2001-07-09T22:22:22Z
Garlic, Kathrine, Female, Orange, 1992-03-07T16:53:55Z
Bushnell, Ariel, Female, Indigo, 1991-10-09T14:56:40Z
DeBeauchemp, Darcie, Female, Orange, 2011-05-03T12:51:01Z
Thebe, Jammie, Female, Yellow, 2001-03-14T13:58:25Z
Gallymore, Carlynn, Female, Red, 2003-04-14T03:47:58Z
Nicol, Jean, Male, Red, 1995-12-26T12:49:37Z
Ladloe, Alister, Male, Red, 2004-04-20T20:36:52Z
Brito, Ashely, Female, Violet, 2011-09-04T06:11:16Z
Fallen, Alberik, Male, Yellow, 2007-12-24T01:13:05Z
Silcocks, Shawn, Male, Orange, 2001-01-24T15:59:52Z
Keems, Roscoe, Male, Violet, 2014-12-06T04:14:56Z
Gloster, Mycah, Male, Red, 2014-02-01T06:16:44Z
Reams, Den, Male, Black, 2011-09-14T10:38:18Z
Meneer, Giffard, Male, Yellow, 2003-11-20T19:04:48Z
Ygo, Elene, Female, Blue, 1993-08-25T16:02:19Z
Seymer, Arni, Male, Orange, 2002-06-05T01:49:03Z
Wittke, Blondy, Female, Violet, 2007-03-13T17:19:41Z
Keddy, Samson, Male, Indigo, 1998-04-25T13:08:26Z
Rasher, Jereme, Male, Black, 2009-11-02T15:02:30Z
Beevors, Em, Male, Red, 1995-08-17T15:22:05Z
Blackham, Marinna, Female, Indigo, 1994-10-09T15:39:03Z
Lethbury, Rennie, Female, Red, 2006-12-29T11:51:27Z
Pickworth, Abigael, Female, Blue, 2004-07-30T11:30:53Z
Humbles, Gene, Female, Red, 2014-05-20T06:06:29Z
Parmenter, Jarret, Male, Black, 2002-07-16T15:28:56Z
Upwood, Mel, Female, Blue, 2017-06-16T14:22:48Z
Acey, Dominic, Male, Red, 1996-04-23T07:02:47Z
Eam, Gaspar, Male, Blue, 2004-10-08T19:03:18Z
Lilford, Bernhard, Male, Green, 2017-01-01T13:28:49Z
Elletson, Josefina, Female, Yellow, 1992-02-10T10:03:44Z
Espinazo, Rolf, Male, Black, 2005-11-30T05:39:58Z
Gouny, Kirbee, Female, Indigo, 1993-10-12T20:32:40Z
Atchly, Oberon, Male, Orange, 1999-04-28T22:23:43Z
Tinklin, Oliviero, Male, Red, 2001-12-04T21:30:35Z
Glaum, Clovis, Female, Red, 1990-05-27T15:24:12Z
Whellams, Violette, Female, Green, 1996-07-07T22:11:53Z
O'Doireidh, Tatum, Female, Green, 2007-10-18T18:10:38Z
Joppich, Sally, Female, Indigo, 2017-02-04T08:53:26Z
Belin, Naomi, Female, Black, 2000-07-11T06:41:45Z
Guild, Idelle, Female, Yellow, 2005-08-22T09:44:44Z
Faill, Edwina, Female, Green, 2014-01-24T15:28:50Z
Sikorsky, Cirillo, Male, Black, 2010-01-29T16:50:18Z
Greatrex, Purcell, Male, Orange, 2000-07-02T15:50:34Z
Longden, Selinda, Female, Red, 2000-01-03T20:16:16Z
Baldocci, Claiborne, Male, Blue, 1998-01-30T17:39:12Z
Steeples, Corty, Male, Indigo, 1998-10-13T00:19:50Z
McSperron, Johnath, Female, Yellow, 2011-05-04T10:43:16Z
Claremont, Barbara, Female, Yellow, 1998-07-07T00:48:58Z
Glassborow, Mamie, Female, Blue, 2015-07-24T02:45:07Z
Costellow, Missie, Female, Yellow, 2012-07-16T15:55:49Z
Hammett, Lilas, Female, Indigo, 2011-11-14T09:14:46Z
Skrines, Karina, Female, Green, 2001-09-03T10:41:48Z
Picken, Kira, Female, Indigo, 2012-04-02T02:06:25Z
Issard, Miner, Male, White, 1990-11-03T04:31:55Z
Theuff, Nessi, Female, White, 2017-11-17T08:30:42Z
Waistell, Marys, Female, Green, 1990-01-16T10:34:33Z
Clay, Raimondo, Male, Black, 2001-04-04T23:41:08Z
Leahey, Shawn, Female, Violet, 2011-01-07T05:50:17Z
Collerd, Thebault, Male, Blue, 2000-05-30T20:51:35Z
Cristofolini, Helen, Female, Yellow, 2003-05-20T09:32:08Z
Kasperski, Jewel, Female, Green, 2014-10-01T05:36:08Z
Boatwright, Sol, Male, Orange, 1992-03-01T20:23:41Z
Flanne, Massimiliano, Male, Black, 2015-07-03T20:56:36Z
Fayers, Gene, Female, Indigo, 2012-12-28T00:13:13Z
Ebenezer, Amelia, Female, Yellow, 1993-02-23T09:57:23Z
Walder, Jeddy, Male, White, 1996-06-09T09:11:40Z
Verdun, Mirabelle, Female, Red, 2004-10-17T03:48:13Z
Le-Good, Josephine, Female, White, 1992-09-12T07:06:44Z
Olland, Costa, Male, White, 2008-03-04T06:15:05Z
Burle, Karilynn, Female, Yellow, 2010-01-19T17:33:27Z
Jarrelt, Kurt, Male, White, 1996-09-18T12:03:31Z
Doxey, Candra, Female, Black, 2001-09-17T11:38:43Z
Applebee, Jessee, Male, Black, 1991-03-20T19:10:24Z
Shirtcliffe, Arielle, Female, Violet, 2004-02-13T17:21:45Z
Bausmann, Randene, Female, Black, 2016-06-08T12:19:00Z
Ambrogio, Clemente, Male, Orange, 2002-03-15T07:16:23Z
Lisle, Jude, Male, Red, 2016-11-21T02:19:56Z
Cuddon, Burl, Male, Green, 2000-11-28T03:23:13Z
Spawforth, Tori, Female, White, 2001-03-21T21:37:04Z
Shildrick, Bridie, Female, Indigo, 2014-06-28T11:54:30Z
Guisler, Dominga, Female, Indigo, 2005-06-09T21:54:22Z
Digan, Trixy, Female, Blue, 2014-03-23T02:53:57Z
Moncrefe, Tara, Female, Green, 1996-01-17T04:54:56Z
Annwyl, Cherry, Female, Blue, 2018-02-14T04:57:49Z
Dadswell, Deidre, Female, Indigo, 1995-09-24T00:53:13Z
Droogan, Lil, Female, Blue, 2000-10-21T06:20:23Z
Glyssanne, Nealson, Male, Red, 2017-07-11T23:17:10Z
Long, Helaine, Female, Green, 1995-03-28T05:24:47Z
Doe, Sigismundo, Male, Red, 1999-05-13T11:05:15Z
Fisk, Gaspard, Male, Yellow, 2014-01-07T03:06:42Z
Quarrie, Hermy, Male, Black, 2006-07-17T15:18:29Z
Trench, Sherry, Female, Violet, 2001-08-31T13:14:07Z
Stanistreet, Georgeanne, Female, White, 2012-12-23T06:20:56Z
Spray, Lauren, Female, Yellow, 2006-06-29T18:18:29Z
Giffon, Wilona, Female, Black, 2001-03-16T23:33:04Z
Ferroli, Raymond, Male, Blue, 1996-07-05T08:12:08Z
Tinn, Tisha, Female, Black, 2010-06-19T18:18:41Z
McCobb, Evanne, Female, Green, 2018-06-21T23:26:15Z
Hatch, Vale, Male, Violet, 1994-01-25T12:49:34Z
Loughney, Mercie, Female, Red, 2014-04-08T17:08:12Z
Delnevo, Kendell, Male, Blue, 2011-03-09T23:43:10Z
Dalzell, Andrus, Male, Indigo, 2013-04-06T21:35:22Z
Lennarde, Bellanca, Female, Blue, 2015-04-07T14:31:32Z
Antat, Brnaba, Male, Green, 2008-12-09T12:20:58Z
Mulder, Sabra, Female, Indigo, 2005-01-18T13:07:41Z
Reeder, Clement, Male, Orange, 2012-08-21T15:36:50Z
Scudder, Uriel, Male, Green, 2014-09-09T18:41:48Z
Myford, Roscoe, Male, Blue, 2005-03-27T23:20:53Z
Kermott, Carroll, Male, White, 2017-12-12T04:17:14Z
Storey, Emory, Male, Black, 1994-12-24T16:52:05Z
Theodore, Babbie, Female, Black, 2009-02-05T07:10:31Z
Puleque, Way, Male, Yellow, 1990-08-29T12:16:40Z
Kubanek, Shell, Male, White, 2007-06-12T01:58:08Z
Keyworth, Goldi, Female, Violet, 1990-10-09T14:34:41Z
Bozier, Marco, Male, Indigo, 1991-10-27T17:35:14Z
Simmans, Whitman, Male, White, 2016-07-23T01:52:08Z
Fold, Darrel, Male, Orange, 2011-04-19T17:03:12Z
Siuda, Fayette, Female, Blue, 2013-03-30T02:14:22Z
Bompass, Darsie, Female, White, 2001-10-14T01:12:19Z
Trawin, Moe, Male, Red, 2013-09-09T08:05:38Z
Yearns, Virginia, Female, Orange, 2003-02-28T11:28:31Z
Simpole, Maiga, Female, Green, 1993-11-13T22:23:59Z
Tendahl, Harold, Male, Yellow, 2006-04-06T12:15:28Z
Deveral, Abbott, Male, Orange, 2014-12-11T06:39:17Z
Spaight, Sander, Male, Red, 1994-03-22T09:12:11Z
Lockhead, Dene, Male, Red, 2003-02-13T19:27:08Z
Muzzlewhite, Artemis, Male, Black, 1998-04-15T21:25:38Z
Feeley, Kata, Female, Indigo, 2018-07-17T13:04:12Z
Shillam, Kesley, Female, Yellow, 2013-09-19T09:08:09Z
Nicol, Orin, Male, Red, 2010-01-22T15:47:17Z
Goodwell, Guinna, Female, Yellow, 1994-04-03T19:38:56Z
Cicco, Gawen, Male, Blue, 2009-12-30T09:50:05Z
Verden, Merrick, Male, Violet, 2013-05-09T17:01:19Z
Brendel, Maurise, Female, Red, 2018-03-13T15:49:39Z
Scotchmur, Winthrop, Male, Violet, 1992-04-18T00:24:49Z
Stillert, Aubrey, Male, Orange, 1992-12-26T21:11:14Z
Brabon, Sansone, Male, Blue, 1995-09-19T18:27:33Z
Sagar, Beverlie, Female, Indigo, 2017-11-24T08:26:30Z
Reucastle, Sileas, Female, Orange, 2002-04-22T17:41:48Z
Clardge, Corina, Female, Violet, 2004-01-17T19:20:36Z
Isaacson, Donny, Male, Green, 2013-10-03T07:43:49Z
Cahan, Ogdan, Male, Blue, 2018-02-17T04:27:09Z
Margeram, Emalia, Female, Green, 2003-01-10T04:53:16Z
MacAndreis, Isac, Male, Indigo, 2013-08-09T10:29:25Z
Forsyth, Melessa, Female, Red, 1990-01-28T14:58:42Z
Crowdy, Alanah, Female, Yellow, 2002-09-04T22:19:16Z
Mardlin, Elia, Male, Black, 1990-07-05T11:35:59Z
Clemenzo, Elita, Female, Yellow, 1998-11-16T12:53:06Z
McSperrin, Jenine, Female, Blue, 2013-10-25T00:32:41Z
Giametti, Bram, Male, White, 1992-09-08T11:35:45Z
Okell, Elbert, Male, Blue, 2016-08-07T23:53:47Z
Harryman, Katine, Female, Violet, 2014-06-05T01:22:18Z
Mattiussi, Kinsley, Male, Black, 2003-01-31T11:55:50Z
Clash, Heywood, Male, White, 2000-03-26T00:33:49Z
Gladdolph, Fran, Male, Indigo, 2003-01-30T12:53:00Z
Callow, Lemmie, Male, Violet, 2009-02-21T20:50:08Z
Dods, Ramona, Female, Indigo, 1990-09-10T13:48:04Z
Simkins, Lenette, Female, Yellow, 2008-08-22T03:29:18Z
Bartell, Tadio, Male, Black, 2001-10-02T06:31:56Z
Blackah, Alphonso, Male, Indigo, 2006-08-13T06:16:19Z
Pettit, Torrie, Female, Orange, 2000-09-29T15:14:58Z
Pavlata, Bev, Male, Red, 1996-06-10T04:30:02Z
Dupey, Leta, Female, White, 2000-01-10T13:15:58Z
Wearing, Nathan, Male, Green, 2009-01-21T08:10:57Z
Jellybrand, Wainwright, Male, Black, 2015-12-23T11:23:50Z
Gowdie, Eliot, Male, Indigo, 1995-10-27T11:21:34Z
Cubley, Valentino, Male, Black, 2015-05-11T04:12:26Z
Shakeshaft, Leesa, Female, Indigo, 2015-05-24T19:58:05Z
Tohill, Deck, Male, Indigo, 1992-06-09T08:34:53Z
Jeandel, Leontyne, Female, Red, 2005-04-01T09:27:57Z
Manby, Julia, Female, Violet, 2011-09-12T16:39:42Z
Cuthbert, Jasper, Male, Orange, 2016-11-25T18:50:55Z
Riddiough, Mannie, Male, Black, 2004-02-13T17:23:13Z
Dadley, Oriana, Female, Green, 2006-04-29T08:31:31Z
Necolds, Baily, Male, Red, 2007-08-03T03:07:13Z
Yakobowitch, Faunie, Female, Indigo, 2012-08-23T16:19:14Z
Garfit, Tarra, Female, Black, 1990-02-05T18:29:27Z
L'Amie, Ragnar, Male, Violet, 1993-02-24T18:59:58Z
Redhead, Yank, Male, Orange, 2013-03-14T18:54:45Z
Beausang, Vincenty, Male, Black, 1991-06-20T03:05:39Z
Defont, Lexine, Female, Red, 1992-12-01T08:58:01Z
Reisenstein, Binky, Male, Indigo, 1991-05-26T03:12:12Z
Birtley, Verna, Female, Green, 1992-07-08T21:45:02Z
Effaunt, Packston, Male, Violet, 1997-08-24T00:42:25Z
Arstall, Jeane, Female, Black, 2004-03-09T22:30:38Z
Kibard, Chaim, Male, Black, 2006-05-23T08:31:34Z
Bebbington, Lusa, Female, Red, 1999-01-15T07:50:36Z
Dossett, Elliott, Male, Violet, 1999-09-25T08:11:35Z
Raspel, Fran, Female, Red, 2009-08-11T00:31:10Z
Lubman, Ailey, Female, Green, 1995-01-09T06:35:56Z
Barthelet, Brynna, Female, Yellow, 1999-05-25T23:53:36Z
Eastmead, Gualterio, Male, Black, 2003-10-27T08:59:44Z
Baumann, Englebert, Male, Indigo, 1997-03-08T14:29:43Z
Wrought, Keenan, Male, Red, 2006-07-10T01:46:31Z
Silverthorne, Alverta, Female, Yellow, 2011-05-02T15:01:53Z
Clamo, Baird, Male, Black, 2018-02-09T09:44:06Z
Devinn, Raviv, Male, Orange, 2011-06-12T21:48:06Z
Filintsev, Dorella, Female, Orange, 1990-12-17T13:12:54Z
Andreacci, Mikael, Male, Orange, 2010-11-12T03:25:40Z
Roskilly, Bertrando, Male, Yellow, 2005-09-10T15:33:26Z
Websdale, Kalvin, Male, Blue, 2005-02-12T10:19:58Z
Blankett, Agretha, Female, Violet, 2013-06-21T01:06:29Z
Lauxmann, Emelina, Female, Orange, 1997-07-13T04:52:39Z
Dumke, Garald, Male, Orange, 1990-02-16T03:27:20Z
Gumery, Laurianne, Female, Yellow, 1997-05-27T20:32:48Z
Barnet, Lizette, Female, Orange, 1991-04-15T01:11:59Z
Barnwill, Forrest, Male, Red, 2015-04-18T21:19:34Z
Gowling, Ardella, Female, Blue, 2014-11-24T01:21:59Z
Westgarth, Erasmus, Male, Red, 2008-01-22T10:59:48Z
McConnel, Giorgia, Female, Yellow, 2008-10-08T05:35:24Z
Ponceford, Giff, Male, Blue, 2004-07-19T06:56:35Z
Pikesley, Agatha, Female, Violet, 2003-07-13T03:40:57Z
Grimsdale, Rancell, Male, Yellow, 2007-05-03T11:30:08Z
Perell, Brigit, Female, Violet, 2003-06-30T10:36:39Z
Minker, Emmet, Male, White, 1995-05-01T09:06:46Z
Gummoe, Tabby, Male, Red, 1991-02-28T07:42:10Z
Iveagh, Billi, Female, Red, 1998-07-31T09:45:11Z
McKeachie, Dick, Male, Indigo, 2008-11-20T17:19:17Z
Eidelman, Leora, Female, Orange, 2004-02-19T01:33:08Z
DeRuggero, Elaina, Female, Red, 1991-01-31T14:40:19Z
Dudson, Dan, Male, Indigo, 2007-04-24T08:52:31Z
Allaway, Dalia, Female, Indigo, 2001-02-17T08:35:49Z
Roels, Lanny, Male, Orange, 1997-12-16T16:25:39Z
Tothacot, Willyt, Female, Blue, 2011-09-12T02:11:30Z
Dobby, Bernadette, Female, Black, 2004-08-11T10:03:07Z
Mooreed, Zollie, Male, Blue, 2017-06-11T07:20:52Z
Knightsbridge, Lea, Female, White, 1998-04-20T20:06:57Z
Cisson, Enrika, Female, Green, 2005-03-03T03:30:14Z
Dunckley, Berkie, Male, Yellow, 2015-05-28T01:17:41Z
Ravelus, Isis, Female, Indigo, 1999-08-11T23:19:08Z
Bumfrey, Eddy, Male, Yellow, 1994-05-22T14:28:31Z
Ellingworth, Nicko, Male, Violet, 2000-07-13T08:02:52Z
Ollerearnshaw, Sashenka, Female, Blue, 1993-10-20T00:56:14Z
Sphinxe, Edouard, Male, Indigo, 1995-10-12T19:01:44Z
Mapson, Madelene, Female, Indigo, 1994-03-10T12:25:26Z
Hovell, Keven, Male, White, 1990-02-20T15:55:37Z
DeRoberto, Alistair, Male, Violet, 2003-02-16T05:59:26Z
Sollam, Emmie, Female, Black, 2011-10-12T01:50:56Z
Sturm, Weider, Male, Red, 1997-08-01T20:21:45Z
Donwell, Nicole, Female, Blue, 1994-03-13T16:12:17Z
Chastenet, Olenolin, Male, Blue, 2004-06-04T02:33:36Z
Gover, Maritsa, Female, Orange, 2016-12-16T06:52:00Z
Presdee, Seline, Female, Blue, 2004-05-30T13:39:31Z
McArt, Valera, Female, Orange, 1990-02-07T20:55:53Z
Shouler, Lucia, Female, Red, 2015-07-07T22:58:50Z
Garthland, Kendall, Male, Indigo, 2005-05-15T19:50:02Z
Rawnsley, Simmonds, Male, Orange, 1992-01-18T00:10:22Z
Tunnah, Godwin, Male, Indigo, 2011-11-23T05:58:04Z
Wayte, Malachi, Male, Orange, 2001-04-25T08:52:49Z
Domelow, Michelina, Female, Blue, 1992-06-22T22:54:32Z
Hidderley, Culley, Male, Red, 2009-05-07T05:41:38Z
Andriessen, Miner, Male, Orange, 2000-07-22T23:42:53Z
Coale, Brittne, Female, Orange, 2012-12-09T03:43:35Z
Tedman, Tybi, Female, Yellow, 1993-11-27T22:51:17Z
McGuffog, Emmett, Male, Black, 1992-06-17T17:18:34Z
Duker, Emelen, Male, Blue, 2006-01-13T22:04:41Z
Gonning, Natal, Male, Violet, 2013-11-10T14:30:10Z
Danelutti, Gusta, Female, Violet, 2003-06-09T01:04:14Z
Firpi, Renard, Male, Green, 2008-12-13T01:45:34Z
Tolomei, Randy, Female, Blue, 1990-12-17T05:06:22Z
Wignall, Bastien, Male, Indigo, 2017-10-13T12:29:30Z
Luddy, Sidnee, Male, White, 2009-12-01T17:48:40Z
Heinz, Grazia, Female, Yellow, 1996-09-03T09:38:03Z
Drayton, Gwenni, Female, Orange, 2014-05-16T02:58:02Z
Heinsius, Camel, Female, Green, 2000-10-05T08:18:05Z
Brecon, Rozelle, Female, Indigo, 2017-10-03T20:39:14Z
Bonwell, Erroll, Male, Indigo, 2007-04-27T11:09:21Z
Seivertsen, Lacy, Female, Yellow, 2000-07-29T03:38:40Z
Leathem, Marya, Female, White, 2008-04-02T14:06:19Z
Barnet, Kathe, Female, Violet, 1999-07-28T11:28:13Z
Wordsley, Tedd, Male, White, 2007-11-29T00:39:48Z
Zanni, Rabbi, Male, Green, 1997-10-13T06:23:54Z
Delves, Morgan, Female, Green, 1992-02-14T04:23:24Z
Allanson, Kliment, Male, Black, 2017-09-11T07:43:39Z
Silcocks, Georas, Male, Blue, 1993-11-29T05:45:59Z
Gowrie, Dermot, Male, Yellow, 2012-10-06T12:42:32Z
Simants, Pauly, Female, White, 1992-12-29T18:33:19Z
Chanders, Riva, Female, Black, 1996-09-30T23:59:41Z
Bowden, Temple, Male, Black, 2017-02-06T00:28:28Z
Mathevet, Kendricks, Male, Green, 1996-03-22T13:47:34Z
Olivet, Scottie, Male, Black, 1993-10-01T12:14:17Z
Scay, Lorilee, Female, Orange, 1999-11-05T00:30:37Z
Wodeland, Zechariah, Male, Red, 2009-07-20T11:34:07Z
Nottle, Harp, Male, Black, 2017-02-02T06:05:56Z
Verner, Daron, Female, Violet, 2001-11-06T09:08:01Z
Capozzi, Torey, Male, Yellow, 2000-08-05T13:07:05Z
Handyside, Blithe, Female, Green, 1994-05-30T03:53:33Z
Kinde, Hube, Male, Indigo, 2005-03-11T10:05:30Z
Blackall, Mordy, Male, Indigo, 1995-06-09T09:04:16Z
Padmore, Renard, Male, Yellow, 1996-10-14T22:39:37Z
Parramore, Justinn, Female, White, 2013-12-08T07:57:29Z
Callacher, Griff, Male, White, 2009-04-28T11:13:34Z
Polkinhorn, Korry, Female, Green, 2016-09-12T05:43:26Z
Ciabatteri, Napoleon, Male, Indigo, 1999-08-28T14:29:39Z
Daltrey, Guinna, Female, Yellow, 2005-02-15T16:29:10Z
Hune, Sela, Female, Yellow, 2000-05-30T17:12:04Z
Parncutt, Bartie, Male, Yellow, 1990-04-05T13:55:09Z
Olding, Lois, Female, Green, 2011-12-09T20:49:57Z
Dedman, Misha, Female, Indigo, 1998-07-09T11:02:13Z
Blasiak, Adam, Male, Violet, 2000-03-11T03:08:10Z
Somner, Basilio, Male, Indigo, 1997-01-20T12:01:11Z
Whitland, Cecily, Female, Red, 1990-11-25T08:54:17Z
Kliment, Murry, Male, White, 2002-05-12T04:38:22Z
Merrett, Griffie, Male, Red, 1996-10-02T04:42:08Z
Gori, Wendeline, Female, White, 2016-03-11T14:53:38Z
Arnot, Sherm, Male, Yellow, 1996-03-14T02:36:12Z
Fullilove, Elvin, Male, Violet, 2018-04-21T21:43:52Z
Thornebarrow, Lazare, Male, Violet, 2011-01-18T05:36:33Z
Ludron, Cchaddie, Male, Yellow, 2005-06-11T19:22:51Z
Vurley, Justus, Male, Green, 2013-05-22T03:13:38Z
Prettyman, Tiebout, Male, White, 2001-01-03T07:18:09Z
Korous, Emlynne, Female, Blue, 1995-07-25T12:35:00Z
Farlamb, Nobie, Male, Green, 1997-12-24T07:53:18Z
Tearle, Madelina, Female, Black, 2011-01-03T11:04:16Z
Dancy, Oralia, Female, Yellow, 2003-07-02T11:14:47Z
Duligal, Bernadine, Female, Indigo, 1997-06-29T01:57:01Z
Devorill, Barthel, Male, Yellow, 2010-10-31T14:49:19Z
Spore, Rabbi, Male, Blue, 1992-06-04T02:00:00Z
Roberto, Andrew, Male, Indigo, 2005-01-31T03:11:22Z
Standingford, Christiane, Female, Red, 1993-10-23T08:28:43Z
Scorthorne, Derril, Male, Green, 1992-10-30T13:40:56Z
Bauld, Keslie, Female, Orange, 2004-11-11T19:29:14Z
Frascone, Irita, Female, Green, 2009-03-18T14:22:46Z
Milbank, Lorrayne, Female, Violet, 2005-10-25T23:41:12Z
Letch, Thalia, Female, Indigo, 1994-06-10T18:28:20Z
Varlow, Katee, Female, Black, 2009-02-17T00:44:19Z
Shearsby, Mordecai, Male, Green, 2013-04-23T20:23:28Z
MacClancey, Fifi, Female, Orange, 1997-02-05T11:21:18Z
Giocannoni, Ekaterina, Female, Indigo, 2001-12-27T12:13:41Z
Rosenbarg, Farrah, Female, Violet, 1999-01-31T09:22:19Z
Pilmer, Rodolfo, Male, Green, 2002-02-07T08:11:25Z
Elsmore, Michaeline, Female, Black, 2010-04-18T13:47:30Z
Kubis, Ines, Female, White, 2006-03-10T18:01:21Z
Burtwhistle, Guilbert, Male, Orange, 1990-03-25T22:59:34Z
Kidder, Madelon, Female, Violet, 2017-06-27T00:40:02Z
Duddan, Annnora, Female, Red, 1994-05-22T17:59:42Z
Blue, Vinson, Male, Indigo, 1995-09-02T00:59:13Z
Hodges, Susette, Female, Blue, 1990-09-09T09:05:23Z
Riddiough, Ilsa, Female, White, 2011-02-17T00:26:36Z
Hanigan, Brok, Male, White, 2008-05-01T12:40:38Z
Gilston, Damara, Female, Violet, 1991-03-08T21:56:06Z
Ablitt, Gerik, Male, Black, 1995-02-17T02:38:13Z
Kenen, Demetrius, Male, Violet, 1991-01-06T14:28:35Z
Hawford, Wit, Male, Red, 2005-08-10T13:17:18Z
Kealy, Adelaide, Female, Green, 1991-08-28T08:13:37Z
Cristou, Bernete, Female, Red, 1995-10-25T08:33:16Z
Geraghty, Bing, Male, Yellow, 1993-08-06T15:26:35Z
Meardon, Anna-diana, Female, White, 2015-10-11T17:22:16Z
Fritchley, Adriane, Female, Yellow, 1990-04-27T04:52:18Z
Bisp, Stevie, Male, White, 2001-06-29T09:37:55Z
Hext, Sergio, Male, Black, 1992-09-22T08:43:31Z
Pecht, Lucian, Male, White, 1994-04-08T06:45:50Z
Bowbrick, Mary, Female, Black, 2008-07-01T14:43:49Z
Kyndred, Darlene, Female, White, 2017-10-24T09:28:00Z
Ludgrove, Clive, Male, Orange, 2011-03-29T08:38:51Z
Bransgrove, Erina, Female, Blue, 1990-08-20T04:45:02Z
Boarer, Padget, Male, Orange, 2015-07-10T11:10:57Z
Richardt, Helen, Female, Red, 1996-07-22T06:30:10Z
Hathwood, Raynard, Male, Black, 2003-01-08T21:59:55Z
Pavkovic, Norbie, Male, Yellow, 2006-05-08T22:11:25Z
Dyball, Eadmund, Male, Red, 2009-11-03T09:52:02Z
Forsey, Michaela, Female, Yellow, 1997-01-19T05:37:39Z
Kells, Frazer, Male, Blue, 2012-09-24T07:26:31Z
Coad, Rozalie, Female, Indigo, 1995-11-30T19:06:49Z
Baglow, Katherine, Female, Red, 2006-06-08T06:40:06Z
Widdows, Hashim, Male, Green, 1997-04-03T20:42:30Z
Houson, Rogers, Male, Orange, 2010-06-10T20:06:48Z
Collelton, Katine, Female, Blue, 2005-08-18T09:59:07Z
Monkhouse, Mathilda, Female, Orange, 2016-12-20T16:58:42Z
O'Towey, Zebadiah, Male, Blue, 2007-02-04T02:14:06Z
Gilburt, Jeth, Male, Green, 2012-01-16T02:25:34Z
Verna, Sheila, Female, White, 2010-09-25T12:29:21Z
Westgate, Nil, Male, Violet, 2006-05-25T07:22:11Z
O'Cannovane, Michail, Male, Green, 2006-10-21T15:47:30Z
Rousby, Allianora, Female, Black, 2008-02-02T16:53:01Z
Spurier, Baxy, Male, Green, 2013-01-20T02:55:13Z
Cannicott, Ivor, Male, Violet, 2011-11-14T10:02:11Z
Beatey, Cissiee, Female, Orange, 2015-11-28T14:38:25Z
Lemmen, Mario, Male, Blue, 2015-10-05T09:58:18Z
Essex, Knox, Male, Black, 2005-11-18T05:44:57Z
Ridgewell, Anatola, Female, Yellow, 2009-08-17T08:18:46Z
Macquire, Nikolaus, Male, Red, 1996-06-11T05:00:15Z
Cantu, Dolly, Female, Black, 2003-06-19T09:50:29Z
Albany, Mandie, Female, Green, 2002-03-20T04:26:07Z
Botte, Hayes, Male, Orange, 2001-04-06T13:08:45Z
Gertz, Colly, Female, Green, 1999-01-08T07:26:35Z
Oxtaby, Estelle, Female, Orange, 2014-12-09T17:19:31Z
Churm, Pia, Female, Yellow, 1991-12-21T21:57:41Z
Tillyer, Rhianon, Female, Orange, 2000-08-10T14:25:45Z
Craster, Howie, Male, White, 1993-01-03T18:28:31Z
Dyment, Kerrin, Female, Yellow, 2006-12-25T09:45:46Z
Drewery, Herc, Male, Orange, 2006-09-15T21:23:27Z
Yeude, Saunderson, Male, Yellow, 1993-10-28T19:18:18Z
Millson, Orran, Male, Black, 1995-07-31T09:10:45Z
Atkyns, Doll, Female, Green, 2005-06-04T06:06:35Z
Fowlestone, Aluin, Male, Black, 1991-07-09T19:10:59Z
MacKim, Fergus, Male, Green, 2010-10-04T02:53:01Z
Yuryshev, Gerrilee, Female, White, 2008-07-13T14:13:38Z
Masterton, Conrade, Male, Green, 2005-12-02T07:31:43Z
Frentz, Nelli, Female, Blue, 1994-09-13T04:57:38Z
Pittendreigh, Arvy, Male, White, 1999-02-20T07:49:48Z
Tomlinson, Charlena, Female, Red, 2013-06-14T04:36:03Z
Tarzey, Melisenda, Female, Green, 1991-07-11T02:20:07Z
Aldersley, Sonnie, Female, Yellow, 2000-11-29T00:46:46Z
Haborn, Bernardine, Female, Blue, 1995-06-01T03:34:43Z
McKean, Teador, Male, Blue, 2005-12-16T01:11:06Z
Gotcher, Luise, Female, Black, 1994-03-02T03:33:57Z
Rodie, Ferdie, Male, White, 2006-01-03T23:34:16Z
