Vany, Bessy, Female, Orange, 2011-08-20T00:31:20Z
Mcwhinney, Tanya, Female, White, 1995-11-18T20:06:56Z
Sainteau, Nathaniel, Male, Indigo, 2009-08-05T04:53:23Z
Haggett, Neda, Female, Indigo, 1997-10-05T16:08:11Z
Klossek, Juieta, Female, White, 2002-06-08T17:40:45Z
Flockhart, Delinda, Female, Violet, 1994-06-01T09:22:35Z
McSpirron, Erika, Female, Indigo, 2018-03-06T10:53:01Z
Gait, Mozelle, Female, Blue, 2012-08-27T21:11:48Z
Osler, Zelda, Female, Violet, 2010-04-11T15:15:09Z
Bellringer, Lorry, Male, Yellow, 2018-04-03T16:24:53Z
Plum, Erina, Female, Yellow, 2016-12-04T04:54:17Z
Armytage, Kalina, Female, Red, 2006-09-19T11:40:41Z
Siddall, Maryl, Female, Indigo, 2007-12-28T07:49:56Z
Delhanty, Sanford, Male, White, 2008-10-01T20:05:46Z
Nise, Maurice, Male, Indigo, 2008-04-20T01:05:34Z
Elsbury, Ophelia, Female, Yellow, 2008-09-01T01:36:56Z
McGeouch, Duffie, Male, White, 1998-10-07T00:29:07Z
Rubery, Lock, Male, Orange, 2008-01-16T00:29:38Z
Cairns, Christiane, Female, Red, 2002-09-20T08:49:53Z
Galea, Ramon, Male, Black, 2006-01-09T07:11:25Z
Peyntue, Gelya, Female, Green, 1994-01-06T04:55:06Z
Bullene, Shandie, Female, Blue, 2010-03-02T04:15:56Z
Finn, Gideon, Male, Red, 2009-07-07T00:49:49Z
Stribbling, Andree, Female, Red, 2011-04-19T22:27:10Z
Rathe, Uta, Female, Violet, 2014-09-17T22:17:16Z
Cathrall, Zacharias, Male, Green, 2013-08-02T02:24:43Z
Manilow, Trina, Female, Indigo, 2001-06-12T07:09:05Z
Slyford, Della, Female, Black, 2017-03-30T09:35:36Z
Petegrew, Linnell, Female, Orange, 1999-06-19T12:11:52Z
Ramage, Salomi, Female, Black, 2005-12-11T23:26:26Z
Petley, Terencio, Male, Orange, 1994-09-06T22:28:50Z
Saunder, Layne, Female, Orange, 1990-12-29T11:47:33Z
Seakings, Prue, Female, Black, 1998-04-18T14:40:59Z
Lottrington, Aundrea, Female, Orange, 2010-06-26T05:33:44Z
Barca, Morry, Male, Green, 2000-05-28T13:46:50Z
Bail, Wynnie, Female, Blue, 2006-07-22T08:27:57Z
Witherow, Otho, Male, Blue, 2003-08-06T00:45:14Z
Braley, Alejandrina, Female, Green, 1990-09-12T09:40:18Z
Westberg, Marco, Male, Orange, 2009-02-08T12:50:11Z
Squibb, Darcee, Female, Black, 2013-12-07T18:20:01Z
Debold, Kerwinn, Male, Red, 2005-10-31T04:14:11Z
Gallager, Mariya, Female, Red, 2007-03-18T18:10:12Z
Spilisy, Jacqui, Female, Black, 2006-04-07T11:43:03Z
Long, Eveline, Female, Yellow, 1993-05-30T09:48:11Z
Valero, Graeme, Male, Red, 1999-02-14T18:55:48Z
Strudwick, Dee-dee, Female, White, 2008-10-23T20:41:25Z
StAngel, Averyl, Female, Red, 2004-06-09T02:58:48Z
Leicester, Jennilee, Female, Green, 1992-10-15T19:49:13Z
Osment, Gael, Male, Green, 1994-02-25T01:56:35Z
Ubsdall, Bradney, Male, Black, 2005-02-12T19:28:20Z
Goose, Tine, Female, Violet, 2003-03-05T02:53:28Z
Besset, Burg, Male, Green, 2010-10-29T01:00:42Z
McComb, Opalina, Female, Indigo, 1992-11-04T03:16:06Z
Rilston, Mead, Female, Yellow, 1998-10-31T12:10:14Z
Plak, Flint, Male, Black, 1998-07-29T04:31:00Z
Howis, Boycey, Male, Yellow, 2007-02-21T22:18:04Z
Santino, Darryl, Male, Red, 2001-02-12T17:51:22Z
Weighell, Adelaida, Female, Black, 1993-09-22T13:59:12Z
Brockie, Dun, Male, Red, 2015-11-11T06:21:54Z
Cary, Elsworth, Male, Orange, 1997-02-05T19:01:30Z
Tomasutti, Phillie, Female, Orange, 2012-09-06T13:35:35Z
Halsted, Giorgia, Female, Indigo, 2015-05-20T08:01:09Z
Hanstock, Leyla, Female, Indigo, 1990-10-25T03:10:03Z
Pocklington, Eal, Male, Black, 2012-04-14T17:43:26Z
Denacamp, Alano, Male, Green, 2013-06-07T19:20:02Z
Bellingham, Link, Male, Orange, 2016-07-06T00:03:56Z
McComb, Alexandros, Male, Indigo, 2017-04-24T05:58:36Z
Mulligan, Gibbie, Male, White, 2017-05-12T18:51:38Z
Rowbotham, Meir, Male, Black, 2013-09-04T09:08:18Z
Grinnikov, Moina, Female, Red, 2006-01-06T11:47:21Z
Jan, Toma, Female, Violet, 2002-12-17T19:05:38Z
Zoephel, Dixie, Female, Red, 1991-08-18T09:56:16Z
Achurch, Flori, Female, Indigo, 1993-11-15T09:55:37Z
Dimitru, Kermit, Male, Orange, 2003-02-07T07:43:41Z
Drust, Roddy, Male, Indigo, 2014-08-19T12:03:46Z
Burren, Shaine, Female, Blue, 2018-01-04T13:24:20Z
McCartney, Dell, Male, Green, 2008-02-15T06:22:58Z
MacNeil, Berti, Male, Black, 2014-02-22T08:06:35Z
Conechie, Trenna, Female, Blue, 2016-06-06T10:31:16Z
Beardsworth, Reina, Female, Yellow, 2001-07-11T16:09:48Z
Radnedge, Marion, Male, White, 2016-09-12T11:29:44Z
McArthur, Tabby, Male, Yellow, 2000-02-23T03:25:49Z
Collick, Thaxter, Male, Violet, 2009-05-19T03:15:25Z
Alison, Alford, Male, Violet, 2010-08-13T14:20:35Z
McCathy, Diann, Female, Orange, 1992-09-10T22:09:22Z
Wloch, Perice, Male, Yellow, 2005-12-08T14:39:26Z
MacGeaney, Orin, Male, Red, 2014-02-06T02:54:19Z
Kardos-Stowe, Doug, Male, White, 2009-03-26T06:02:46Z
Innis, Brett, Male, Indigo, 1999-08-29T23:03:55Z
Mallindine, Ralina, Female, Green, 1993-11-21T09:52:39Z
Rapkins, Iago, Male, Yellow, 1997-04-20T21:47:43Z
Bambrough, Cyb, Female, Violet, 2015-09-05T03:00:54Z
Dowsett, Everard, Male, Indigo, 2018-02-20T18:39:19Z
Ambroix, Nert, Female, Black, 2000-07-30T12:15:26Z
Catonne, Filbert, Male, Green, 1999-03-09T08:32:59Z
Lung, Ciel, Female, Black, 1990-10-12T10:36:57Z
Henrys, Dulsea, Female, Orange, 1998-01-27T12:47:47Z
Beloe, Fae, Female, Indigo, 2016-09-20T15:05:22Z
Colliss, Avictor, Male, Red, 1996-12-15T16:39:43Z
Eisikovitsh, Nero, Male, Yellow, 1998-08-13T08:37:47Z
Corner, Jean, Female, Blue, 2003-05-22T13:15:00Z
Thurlby, Graig, Male, Black, 2009-09-01T10:38:45Z
Barnaby, Leena, Female, Indigo, 2014-02-19T02:38:53Z
Geraudy, Ariel, Male, Yellow, 2005-01-19T04:22:07Z
Fetherstonhaugh, Kirby, Male, Orange, 2005-10-22T11:33:04Z
LeBatteur, Nerissa, Female, Blue, 2009-05-11T08:29:40Z
Gilkison, Geraldine, Female, Orange, 2012-11-09T21:04:06Z
Giovannazzi, Ted, Female, Green, 2008-04-30T22:00:44Z
Mico, Goran, Male, Blue, 2010-02-10T19:54:55Z
Gudgen, Alice, Female, Black, 1990-05-22T21:19:59Z
Horrod, Bert, Female, Violet, 1998-08-29T08:51:53Z
Dobeson, Ediva, Female, Blue, 2002-06-10T20:16:57Z
Kitlee, Kimmy, Female, Yellow, 2001-12-14T20:38:43Z
Ortzen, Law, Male, Yellow, 2012-12-07T23:37:33Z
Knyvett, Luciano, Male, Violet, 2011-05-17T11:34:26Z
Halford, Jorie, Female, Black, 1993-02-27T07:32:18Z
Lawerence, Kiersten, Female, Green, 2016-06-16T11:16:30Z
Downie, Mariel, Female, Blue, 1997-08-04T11:46:23Z
Pinnigar, Jordon, Male, Violet, 2014-07-15T11:52:38Z
Garrish, Stillman, Male, Black, 2016-02-02T08:29:32Z
Courtin, Alyss, Female, Black, 1992-11-30T23:06:53Z
Beves, Ferrell, Male, White, 1997-05-27T15:27:15Z
Toone, Felike, Male, White, 2009-02-19T09:59:31Z
Oldnall, Dasha, Female, Red, 1994-10-23T04:12:21Z
Waiton, Tandi, Female, Black, 1997-02-14T03:31:59Z
Brunesco, Oona, Female, Indigo, 1998-06-13T22:49:44Z
Rospars, Ruttger, Male, White, 2008-06-10T09:37:14Z
Lardeur, Huberto, Male, Green, 2017-05-16T06:35:51Z
Schimann, Marlon, Male, Violet, 2008-06-22T23:33:58Z
Handaside, Dolly, Female, White, 2008-06-03T19:11:12Z
Beeho, Martie, Female, Red, 2006-08-31T00:05:52Z
Gilhoolie, Godfry, Male, Violet, 1992-09-06T10:16:57Z
Eastbrook, Tobi, Female, Violet, 2014-05-22T20:44:30Z
Rushsorth, Meghann, Female, Blue, 2017-11-04T19:02:16Z
Rodden, Earvin, Male, Orange, 1993-06-27T11:53:24Z
Bullough, Fredelia, Female, Red, 2004-02-21T18:08:35Z
Pollok, Wyn, Male, Black, 2001-08-12T14:07:50Z
Schust, Coop, Male, Indigo, 1996-04-29T10:29:57Z
Leatherborrow, Barth, Male, Orange, 2002-03-28T18:55:43Z
Silversmid, Maude, Female, White, 2017-09-16T15:38:38Z
Sprott, Donn, Male, Green, 1999-05-24T02:37:30Z
Morrison, Maurice, Male, Green, 1992-11-17T09:14:35Z
Caillou, Tildie, Female, Indigo, 1996-11-10T03:26:36Z
Foley, De-witt, Male, Indigo, 2002-06-22T18:48:12Z
Vondrasek, Aleta, Female, Violet, 2004-10-01T14:59:01Z
Gainsbury, Tallou, Female, Blue, 2017-06-24T22:51:06Z
Ianni, Trenton, Male, Red, 1994-11-17T23:07:38Z
Lindwall, Dennie, Male, Green, 2007-10-06T10:23:56Z
Stodart, Deanna, Female, White, 1996-08-27T09:23:54Z
Keers, Zarla, Female, Black, 2013-02-14T03:29:36Z
Wittering, Philis, Female, White, 2003-02-24T13:15:39Z
Luggar, Athene, Female, Indigo, 1991-01-13T08:56:28Z
Ardern, Gideon, Male, Black, 2012-11-06T01:11:50Z
Margarson, Dalis, Male, Green, 2015-03-19T15:40:53Z
Wickardt, Shannen, Female, Red, 1994-05-29T10:31:38Z
Beaver, Jarib, Male, Indigo, 2000-07-28T01:57:26Z
Assante, Lemuel, Male, Red, 2015-05-21T05:31:39Z
Tran, Corbin, Male, Violet, 2017-01-19T22:12:03Z
Bloxam, Findley, Male, Orange, 2014-09-30T17:55:43Z
Bilbery, Clerc, Male, Green, 2017-08-01T17:15:42Z
Axcell, Hartley, Male, Red, 1997-06-18T22:44:43Z
Maisey, Karmen, Female, Violet, 2000-08-02T04:04:59Z
Kenforth, Alasdair, Male, Violet, 2008-01-06T09:10:21Z
MacDuff, Eleni, Female, Black, 2016-01-22T05:44:52Z
Wahncke, Horatia, Female, Black, 1998-01-08T07:19:22Z
Brogiotti, Maximilian, Male, White, 2017-08-29T18:35:07Z
Corballis, Shawna, Female, Violet, 1999-07-17T03:26:15Z
Hacket, Davie, Male, Black, 2004-09-21T17:47:55Z
Fishlee, Arden, Female, Black, 1993-09-19T11:12:13Z
Roby, Deloris, Female, Orange, 2014-09-10T15:01:59Z
Neem, Edlin, Male, Green, 2007-05-16T10:35:35Z
Jutson, Belinda, Female, White, 2005-09-10T02:13:13Z
Wanless, Damaris, Female, Black, 2015-04-03T18:56:26Z
Hennemann, Viviene, Female, Black, 2001-10-13T13:21:56Z
Covolini, Noni, Female, Black, 1990-02-10T14:08:14Z
McGavin, Moyna, Female, Violet, 1998-02-04T17:28:29Z
Jurgen, Oswald, Male, Indigo, 1999-07-16T03:01:24Z
Suttill, Nicholas, Male, White, 1991-05-30T09:40:24Z
Renshall, Florrie, Female, Blue, 2007-06-19T18:37:36Z
Abrahamsen, Tadd, Male, Indigo, 2007-03-24T12:36:57Z
Makinson, Linus, Male, Orange, 2012-09-19T13:43:07Z
Clemmen, Gwendolin, Female, Indigo, 2003-05-20T11:03:34Z
Devonald, Seth, Male, White, 1994-07-20T13:33:32Z
Ewbach, Wilbur, Male, Violet, 2003-04-12T15:13:22Z
Belin, Violetta, Female, Yellow, 2016-04-06T02:19:53Z
Lamburn, Tanney, Male, Green, 1993-09-13T03:15:13Z
Sellar, Adiana, Female, Blue, 2002-03-23T00:26:48Z
McCrackan, Mathias, Male, Red, 2008-07-20T01:39:45Z
Moncur, Gillie, Female, Yellow, 2005-04-06T00:42:23Z
Dawton, David, Male, Green, 2006-10-12T01:06:57Z
Iremonger, Wallace, Male, Yellow, 1995-03-20T17:55:04Z
Lamb-shine, Arvie, Male, Red, 1996-02-29T19:02:28Z
Esmonde, Lalo, Male, Yellow, 2012-09-26T20:28:46Z
Jupp, Shaylynn, Female, Black, 1999-04-22T17:39:16Z
Rainger, Petrina, Female, White, 2014-09-08T01:31:03Z
Beedom, Rosy, Female, Indigo, 2006-11-18T12:17:04Z
Mains, Frasier, Male, White, 2001-07-23T14:08:04Z
Panketh, Gerladina, Female, Red, 1997-10-08T02:00:31Z
Haigh, Lisha, Female, Red, 1993-05-10T20:49:57Z
Pelosi, Kassie, Female, White, 2013-07-11T04:32:12Z
Simnett, Bobbette, Female, White, 2004-08-07T03:47:20Z
Giron, Cookie, Female, Green, 2007-01-19T08:20:35Z
Skermer, Ernestus, Male, Black, 2014-06-07T03:11:27Z
Weems, Othilie, Female, Orange, 2001-07-26T16:30:15Z
Goggey, Darell, Female, Blue, 2007-07-13T06:34:30Z
Cubitt, Spencer, Male, Blue, 1993-08-23T12:33:06Z
Alexsandrowicz, Peyton, Male, Indigo, 1993-02-27T23:47:40Z
Belton, Clayson, Male, Blue, 1995-11-10T11:53:27Z
McInally, Tasia, Female, Blue, 2005-12-23T11:22:31Z
Klyn, Stevana, Female, Orange, 1997-02-07T19:57:32Z
Simla, Burtie, Male, Black, 2002-07-27T17:39:48Z
Crummey, Annabelle, Female, Red, 2010-05-02T16:43:15Z
Gilhoolie, Wandie, Female, Yellow, 2012-08-22T22:40:13Z
Bullivent, Mignonne, Female, Black, 1994-01-09T03:03:32Z
Cleatherow, Rex, Male, Indigo, 2003-01-28T20:53:44Z
Castagnier, Sawyer, Male, Black, 2015-11-07T19:54:36Z
Dy, Mead, Male, Black, 1997-08-07T22:54:21Z
Aisthorpe, Rae, Female, Blue, 2014-04-30T05:51:14Z
Hugin, Simon, Male, Red, 2001-01-08T06:54:51Z
Elleray, Rebecca, Female, Orange, 1999-05-04T17:44:10Z
Clayworth, Erhart, Male, Red, 2005-04-02T14:46:31Z
Doddrell, Humfrid, Male, Green, 2008-07-02T22:49:49Z
Abrashkin, Kizzee, Female, Indigo, 2003-08-08T15:23:48Z
Kyndred, Quinton, Male, Green, 1993-10-08T15:42:57Z
Hanby, Byron, Male, Black, 2009-07-16T09:30:11Z
Grinnov, Sanson, Male, Yellow, 1994-04-13T02:45:34Z
Hazelgreave, Ashil, Female, Indigo, 1993-09-02T13:50:24Z
Arrell, Maxine, Female, Orange, 1990-07-05T00:50:26Z
Beau, Josefina, Female, Indigo, 1995-07-31T04:02:26Z
Everard, Daniel, Male, Orange, 2014-10-04T00:59:46Z
Braund, Alick, Male, Yellow, 2015-04-03T18:17:57Z
Dumbarton, Sigrid, Female, Indigo, 2017-05-16T12:01:18Z
Hawkey, Harris, Male, White, 2012-08-13T05:24:12Z
Lanphere, Anatol, Male, Orange, 1997-01-23T18:53:01Z
Whiffin, Roi, Male, Blue, 2009-09-22T07:00:01Z
Sponer, Nertie, Female, Violet, 1999-04-04T20:32:27Z
Yablsley, Garth, Male, Yellow, 2002-08-26T08:20:37Z
Probin, Jehanna, Female, Blue, 1999-05-08T07:08:53Z
Pfeuffer, Piper, Female, Black, 2010-06-01T10:14:01Z
Nazer, Ketti, Female, Red, 2014-04-11T10:17:25Z
Wildish, Harri, Female, Blue, 2010-01-15T06:09:41Z
Sabie, Nicky, Male, Yellow, 1994-08-31T05:34:48Z
Toretta, Stevy, Male, Orange, 2010-02-02T00:59:15Z
Marthen, Conant, Male, Violet, 2018-01-08T18:48:44Z
Scimone, Mariquilla, Female, Violet, 2017-12-28T04:20:52Z
Phifer, Theobald, Male, Yellow, 1992-03-02T09:19:08Z
Gloy, Cosette, Female, White, 1996-07-16T15:33:20Z
Coatsworth, Lemmie, Male, White, 1992-10-21T12:21:50Z
Cockrell, Clint, Male, Red, 2007-02-26T14:08:14Z
Voelker, Charlene, Female, Violet, 2017-02-03T05:00:20Z
Whybray, Kassia, Female, Indigo, 2009-03-25T21:27:39Z
DiPietro, Donny, Male, Indigo, 2017-04-10T12:38:49Z
Breckenridge, Reginald, Male, Yellow, 2006-10-21T21:21:59Z
Kayne, Jaimie, Male, Black, 2018-01-21T02:35:58Z
Sigert, Marieann, Female, Green, 2003-05-11T05:00:14Z
Thornthwaite, Alleyn, Male, Orange, 1995-07-14T11:24:37Z
Mulran, Jonell, Female, Yellow, 2015-03-25T09:36:23Z
Hammerson, Red, Male, Black, 1997-08-01T16:22:45Z
Sturton, Merwyn, Male, Indigo, 2010-08-11T21:03:49Z
Spragg, Dianne, Female, Blue, 2016-11-18T15:09:29Z
Bytheway, Jacobo, Male, Red, 2007-07-26T08:23:06Z
Mandy, Hermina, Female, Black, 2008-03-14T07:54:11Z
Jochanany, Evelin, Male, Green, 2001-02-18T11:21:10Z
Helder, Viola, Female, Black, 2017-10-23T17:59:16Z
Corley, Chaddy, Male, Blue, 2001-08-26T18:59:23Z
Cortes, Laney, Female, Yellow, 1999-09-26T12:42:45Z
Fortie, Christan, Female, Blue, 2002-08-05T23:12:43Z
Gamil, Davis, Male, Black, 2004-01-07T19:49:53Z
Dockree, Myrilla, Female, Indigo, 2000-08-28T10:31:34Z
Matresse, Brenna, Female, White, 2013-02-16T04:13:01Z
Verriour, Muffin, Female, Black, 2014-02-01T03:51:40Z
Lugton, Xenia, Female, Indigo, 2015-01-06T10:10:11Z
Tortice, Tait, Male, Blue, 2010-04-13T09:48:59Z
Penburton, Haskell, Male, Violet, 2007-05-10T17:49:55Z
Ansell, Belinda, Female, Indigo, 1990-12-06T09:37:32Z
Spacey, Catie, Female, Violet, 1994-04-26T16:34:24Z
Winthrop, Donny, Female, Red, 2009-08-03T06:36:06Z
Ashment, Griffin, Male, Blue, 1998-10-11T12:10:02Z
Guyot, Javier, Male, Orange, 2009-09-14T11:38:36Z
Bleything, Sylas, Male, Orange, 1996-06-28T14:32:12Z
MacGahey, Jenica, Female, Violet, 2015-01-23T18:31:37Z
Haslegrave, Corabel, Female, White, 2003-06-04T04:21:54Z
Beall, Jozef, Male, Orange, 1990-01-17T08:48:35Z
Bruhnsen, Perkin, Male, Blue, 2002-11-14T02:16:09Z
Lishman, Ty, Male, Green, 2003-07-22T23:57:53Z
Cresar, Harry, Male, Blue, 2016-01-16T12:44:14Z
Tuplin, Ferdinand, Male, Indigo, 1992-12-21T23:54:05Z
Duplan, Daisy, Female, Indigo, 1993-05-02T09:38:59Z
Sharpous, Barty, Male, White, 2010-12-04T17:48:20Z
Eagell, Husain, Male, Red, 2013-10-31T09:52:59Z
Collar, Gerhardine, Female, White, 1995-10-21T15:15:31Z
Martinec, Guthry, Male, Violet, 2004-07-29T01:24:11Z
Valentetti, Monica, Female, Green, 2010-08-09T11:50:11Z
Foulcher, Nollie, Male, White, 2010-01-16T14:23:17Z
Balls, Emanuel, Male, White, 2013-10-16T05:34:50Z
Brumfitt, Abdul, Male, Black, 2000-01-02T15:36:09Z
Keach, Myrtle, Female, Orange, 2007-05-25T19:30:34Z
Blurton, Wald, Male, Blue, 1993-12-21T10:41:30Z
Tynewell, Bendicty, Male, Blue, 2016-08-19T09:28:48Z
Haslehurst, Ario, Male, Yellow, 1990-09-04T22:26:29Z
Wrintmore, Emmanuel, Male, Red, 2003-11-10T13:22:38Z
Dymond, Yancy, Male, White, 2007-07-31T08:39:00Z
Gatman, Tabina, Female, Blue, 2011-10-02T20:24:46Z
Laxston, Vonni, Female, Violet, 2018-05-24T21:00:33Z
Issacson, Tommie, Female, Black, 2014-11-15T18:05:53Z
Entreis, Norah, Female, Indigo, 2003-05-03T08:20:27Z
Terbrugge, Wyatan, Male, Orange, 2011-08-28T01:30:45Z
Fauguel, Mariana, Female, Green, 2018-05-02T11:25:19Z
Thorouggood, Lay, Male, Orange, 2016-06-01T02:00:21Z
Gossart, Sybil, Female, White, 2012-09-16T20:23:22Z
Guymer, Carissa, Female, Indigo, 2006-03-21T23:04:36Z
Shepherdson, Deidre, Female, Green, 2014-01-22T20:50:47Z
Melrose, Gregory, Male, Violet, 2009-10-25T03:58:04Z
Dutt, Ragnar, Male, Green, 2002-10-26T22:02:56Z
Matussov, Saree, Female, Orange, 2003-10-02T14:49:47Z
Gladstone, Ilene, Female, Blue, 2017-09-24T15:22:34Z
Backshill, Gerianna, Female, Red, 2009-12-21T00:14:43Z
Cisec, Cahra, Female, Yellow, 2007-12-17T08:53:55Z
Franey, Peterus, Male, Black, 1993-01-03T09:19:48Z
Beesey, Jo-ann, Female, Violet, 2007-09-15T13:24:29Z
Wedmore, Xenia, Female, Red, 2005-12-18T19:01:48Z
Rudram, Mindy, Female, Blue, 2015-02-06T17:08:11Z
Duigenan, Camila, Female, Blue, 2017-04-11T12:52:10Z
Eastabrook, Yankee, Male, Yellow, 2002-12-14T04:05:34Z
Gove, Jillana, Female, White, 2006-09-03T08:49:04Z
Underhill, Payton, Male, Yellow, 2017-06-12T21:50:12Z
Rany, Sheffy, Male, Black, 1990-08-02T22:07:33Z
Ilyenko, Arie, Male, Red, 2013-05-03T16:59:42Z
Ewert, Elvyn, Male, White, 1997-06-08T00:21:36Z
Laite, Ardine, Female, White, 2001-11-29T07:15:29Z
Gribbon, Sholom, Male, Indigo, 2013-08-01T15:47:05Z
Deny, Sebastiano, Male, Blue, 2000-12-30T14:29:34Z
Amsberger, Caldwell, Male, Green, 1998-01-06T07:03:46Z
Zeplin, Anallise, Female, Orange, 2002-09-09T22:59:04Z
Bruster, Linn, Male, Blue, 2012-08-04T06:04:07Z
Snowden, Huey, Male, Blue, 2012-04-22T15:14:42Z
Adrienne, Evin, Male, White, 2001-08-10T11:12:20Z
Godney, Hestia, Female, Indigo, 2004-03-29T07:49:07Z
Croysdale, Verney, Male, White, 2001-01-19T09:21:09Z
Tomasz, Arthur, Male, Violet, 1993-12-06T21:33:41Z
Duinbleton, Malena, Female, Indigo, 1994-03-10T15:44:05Z
Netting, Hilary, Male, White, 2007-06-19T13:13:24Z
Marjanovic, Valerie, Female, Indigo, 1994-02-26T18:54:04Z
Mantram, Ardine, Female, Orange, 2015-05-14T14:22:48Z
Byard, Gertrud, Female, Violet, 1996-07-07T23:38:46Z
Henrys, Aldrich, Male, Violet, 1995-08-06T20:37:10Z
Everitt, Jerrylee, Female, Yellow, 2012-06-08T09:13:11Z
Jacqueme, Umberto, Male, White, 1995-05-30T07:01:22Z
Missenden, Phyllys, Female, Blue, 2017-05-16T06:06:04Z
Aikett, Gerard, Male, Orange, 1994-11-21T14:15:02Z
Skivington, Dannel, Male, Yellow, 2007-11-16T19:41:09Z
Wickardt, Camellia, Female, White, 2010-12-09T11:57:30Z
Sibbald, Sunny, Female, Indigo, 2012-03-31T04:32:38Z
Davenall, Myrwyn, Male, Blue, 1996-01-23T22:40:56Z
Sandys, Suellen, Female, Black, 2015-02-02T02:38:33Z
Silcock, Temp, Male, Black, 2002-01-17T13:01:24Z
Hutfield, Philipa, Female, Orange, 2013-07-20T03:41:50Z
Coat, Jarrad, Male, Orange, 2011-08-03T21:17:40Z
Tolomelli, Ludwig, Male, Violet, 2003-01-14T20:42:52Z
Brands, Court, Male, Red, 2015-08-20T12:08:35Z
Kohrsen, Jesse, Female, Yellow, 1992-03-04T17:13:02Z
DeWitt, Beth, Female, Blue, 2012-07-24T09:46:21Z
Sumption, Leonidas, Male, White, 2016-09-30T21:40:38Z
Slocum, Giorgia, Female, Blue, 1992-06-07T04:02:55Z
McOnie, Yorgos, Male, Black, 2006-01-09T09:22:16Z
Koenraad, Ephraim, Male, Green, 2004-06-26T18:10:17Z
Alsford, Virginia, Female, Violet, 2011-03-14T23:59:39Z
Weall, Kevan, Male, Violet, 1999-10-04T01:06:08Z
Zotto, Felix, Male, Blue, 2012-03-24T08:45:46Z
Joss, Evvy, Female, Yellow, 2015-10-15T12:13:11Z
Cornels, Meryl, Male, Red, 2016-09-05T07:16:56Z
McKeller, Ambrose, Male, Black, 1993-01-19T19:27:39Z
Crompton, Archibold, Male, Yellow, 2017-12-20T07:20:55Z
Marrow, Kendre, Female, White, 2010-08-01T21:06:21Z
Chugg, Neddy, Male, Red, 2011-03-13T11:13:25Z
Tavernor, Kellby, Male, Yellow, 2011-05-25T22:20:39Z
Grout, Renado, Male, White, 2007-09-20T22:27:34Z
Tesauro, Riordan, Male, Yellow, 2007-04-08T09:29:49Z
Tivers, Joyce, Female, Yellow, 2014-01-18T22:27:33Z
Mollnar, Aloisia, Female, Indigo, 2008-01-17T04:49:33Z
Duchatel, Fabien, Male, Blue, 2016-10-31T09:14:50Z
Gass, Myrna, Female, White, 2014-01-24T14:18:22Z
Kasper, Clementina, Female, White, 2008-06-16T04:05:06Z
Crowdson, Kalvin, Male, Black, 1991-03-12T20:30:21Z
Ledwich, Arnaldo, Male, Red, 2006-04-03T07:12:32Z
Churchouse, Emanuel, Male, Violet, 2004-11-05T23:29:28Z
Proughten, Diahann, Female, Yellow, 1995-09-25T22:04:41Z
Brisson, Justine, Female, Black, 1996-01-19T18:36:47Z
Gook, Yolanda, Female, White, 2015-06-08T07:33:22Z
Brooker, Bartolemo, Male, Blue, 2016-02-09T14:21:04Z
Sprull, Mallissa, Female, Blue, 2015-04-05T19:37:08Z
Josowitz, Ana, Female, Red, 1998-04-01T16:32:54Z
Wearden, Biddy, Female, Green, 1995-01-28T08:37:41Z
Oret, Ronny, Female, Red, 2016-04-24T01:34:20Z
Hebbes, Wendeline, Female, Yellow, 1996-06-25T08:13:46Z
Sucre, Kristine, Female, Red, 2001-07-26T01:54:17Z
Chatfield, Belva, Female, Red, 1999-04-19T09:11:55Z
Vamplew, Glynda, Female, Yellow, 2006-05-07T19:35:19Z
Featley, Chantal, Female, Yellow, 2000-11-27T16:08:58Z
Desmond, Betsy, Female, Yellow, 2007-08-31T11:32:33Z
Fittall, Rinaldo, Male, White, 1994-06-19T12:05:54Z
Kirkbright, Blinni, Female, Violet, 1995-04-26T09:23:43Z
Frears, Rupert, Male, White, 2001-07-05T08:14:09Z
Willbond, Bartholomeus, Male, Violet, 2011-01-12T05:20:54Z
Reicharz, Delmer, Male, Black, 2001-12-17T12:35:17Z
Krauss, Cole, Male, Blue, 2006-02-13T02:45:11Z
Tumilson, Bond, Male, Black, 2007-09-27T11:22:37Z
Biddell, Sutton, Male, Violet, 1997-07-27T04:22:57Z
Rase, Livia, Female, Black, 2010-08-17T01:49:29Z
Brisland, Briano, Male, Blue, 1990-08-12T00:43:19Z
Coverley, Clark, Male, Violet, 2002-02-15T19:14:17Z
Doran, Christian, Female, Blue, 2006-11-29T12:29:55Z
Djurisic, Alfons, Male, Orange, 2001-10-26T02:45:05Z
Sterte, Mendie, Male, Orange, 1999-07-31T23:44:13Z
Ohanessian, Alphonso, Male, Green, 2004-09-12T13:10:14Z
Cromleholme, Annora, Female, Yellow, 2006-01-17T06:48:02Z
Tanzer, Isidor, Male, Violet, 2002-10-16T20:24:13Z
Joust, Corri, Female, Black, 2009-09-26T00:54:42Z
Verrillo, Bentley, Male, Green, 2008-09-01T19:20:36Z
Wethered, Jobie, Female, Violet, 2007-08-06T14:53:17Z
Dugall, Jennine, Female, Violet, 2001-05-16T09:43:54Z
Johansen, Bradly, Male, Blue, 1994-06-09T02:07:41Z
Hugland, Veradis, Female, Blue, 2012-03-01T06:12:16Z
Lebang, Derick, Male, Orange, 1994-04-09T01:12:53Z
Danilovich, Vaclav, Male, Indigo, 1990-06-13T07:55:03Z
Walewski, Gearard, Male, Black, 2001-02-06T01:33:16Z
Beardmore, Ellis, Male, Indigo, 2006-07-29T03:22:27Z
Hubbocks, Jareb, Male, Green, 2002-11-27T09:09:01Z
Chewter, Winifred, Female, Orange, 2015-04-05T08:56:33Z
Semble, Ikey, Male, White, 1992-06-28T10:29:21Z
Sendley, Dix, Female, Yellow, 2005-07-28T23:21:50Z
Cominotti, Terrye, Female, Indigo, 1994-06-30T06:24:50Z
Mangham, Diane-marie, Female, Green, 1997-02-26T00:57:48Z
Sedwick, Kort, Male, Green, 2005-05-07T19:49:42Z
Woodyer, Frederic, Male, Red, 2010-04-26T19:50:19Z
Stains, Randie, Male, Green, 2004-04-16T12:46:05Z
Cressingham, Babette, Female, Yellow, 2002-01-06T07:05:15Z
Thebeaud, Madella, Female, Orange, 1992-12-04T18:41:11Z
Beare, Elfrieda, Female, White, 2000-05-24T23:18:46Z
Liddard, Brewster, Male, White, 2017-02-25T20:19:56Z
Chaldecott, Tanny, Male, Yellow, 1992-01-29T03:43:14Z
Hallen, Diane-marie, Female, Violet, 2012-01-02T23:38:13Z
Barter, Trace, Male, Yellow, 2002-03-02T11:28:41Z
Denacamp, Lib, Female, Green, 1991-11-27T13:22:57Z
McGeorge, Martguerita, Female, Orange, 1992-12-21T03:32:51Z
Foxworthy, Harbert, Male, Violet, 2016-11-17T17:47:39Z
Georgot, Terrell, Male, Orange, 2004-08-05T10:33:11Z
Mattis, Scotti, Male, Green, 1990-03-15T02:07:53Z
Kirman, Jaime, Female, Green, 2015-09-07T07:20:56Z
Gert, Alfie, Male, Red, 2003-10-10T15:12:32Z
Lanyon, Norry, Male, Indigo, 1994-02-21T02:42:50Z
Dummigan, Lorna, Female, Black, 1991-05-06T08:04:35Z
Musso, Marylou, Female, Blue, 2012-08-19T15:11:06Z
Chatain, Myrwyn, Male, Black, 2006-11-23T03:14:49Z
Silk, Krishna, Male, Green, 2012-09-28T06:01:50Z
Ben-Aharon, Wilt, Male, White, 2014-04-18T22:04:51Z
Nelle, Jody, Female, Indigo, 2007-11-02T00:23:17Z
Dreini, Kali, Female, Orange, 2011-01-03T04:57:17Z
Keepin, Ali, Male, Yellow, 1999-11-21T23:37:26Z
Geyton, Tadd, Male, Red, 1997-11-04T02:38:47Z
Titta, Kalinda, Female, Blue, 2016-06-21T16:55:17Z
Bannister, Hastings, Male, Black, 2006-09-09T03:18:13Z
Palia, Cosimo, Male, White, 1994-07-29T19:13:08Z
Lagne, Shelly, Female, Violet, 2018-03-18T12:24:54Z
Starr, Hedwig, Female, Orange, 2010-01-12T14:20:18Z
Bosley, Lianna, Female, Orange, 2004-11-26T22:17:21Z
Lodemann, Katerine, Female, Yellow, 2013-04-20T01:21:34Z
Kiendl, Tracy, Male, Red, 2002-01-07T06:00:59Z
Jewer, Joann, Female, Violet, 2007-06-16T22:26:36Z
Twiggins, Fayina, Female, Green, 2004-04-27T19:25:56Z
Kedge, Michele, Male, White, 1992-04-20T00:01:17Z
Mulqueeny, Colas, Male, White, 1992-07-23T18:33:41Z
Bonnefin, Kelcey, Female, Blue, 2016-02-21T18:56:42Z
Buttriss, Minerva, Female, Blue, 2004-09-08T17:26:42Z
Butner, Shellie, Female, Red, 1999-09-13T01:05:01Z
Domel, Huntington, Male, Red, 1998-10-25T13:47:13Z
Weekland, Kiri, Female, Violet, 1991-03-29T06:38:11Z
Nolton, Natalie, Female, Red, 1998-11-04T08:59:50Z
Ettles, Andrea, Male, Orange, 1995-12-19T06:02:29Z
Magauran, Torie, Female, Green, 1990-03-10T11:42:57Z
Prigg, Bar, Male, Indigo, 1999-03-09T18:48:22Z
Pagon, Darleen, Female, Indigo, 2001-07-09T19:15:01Z
Neeves, Aubine, Female, Yellow, 2014-10-11T06:08:14Z
Suermeier, Henrik, Male, Green, 2003-12-21T02:40:00Z
Ludlom, Milt, Male, White, 1997-03-14T07:15:36Z
Headings, Thibaut, Male, Indigo, 1996-09-20T15:25:38Z
Glisane, Edyth, Female, White, 2005-11-20T16:13:51Z
Teers, Selig, Male, White, 2008-09-24T21:05:54Z
Lakenden, Minor, Male, Indigo, 2003-12-02T18:02:17Z
Dunkerk, Farica, Female, Red, 1995-08-17T19:27:45Z
Hulson, Paola, Female, Blue, 2007-01-14T17:34:11Z
MacVicar, Kikelia, Female, Blue, 2002-12-21T09:04:53Z
Episcopi, Ethelred, Male, Red, 2005-06-08T04:12:15Z
Barnewall, Lowrance, Male, Violet, 2003-09-15T15:50:20Z
Enser, Tommie, Male, Blue, 1991-11-14T22:22:26Z
Van-der-Linde, Noach, Male, Yellow, 2009-08-06T18:56:50Z
Filyushkin, Audy, Female, Black, 1990-10-15T04:08:49Z
DeClairmont, Kriste, Female, Violet, 1993-02-15T05:58:06Z
